{
  "agentOrchestrationConfig": "example-value",
  "arn": "arn:aws:service:us-east-1:123456789012:resource/example",
  "computePlatform": "example-value",
  "createdAt": "example-value",
  "name": "example-resource",
  "profilingStatus": "ACTIVE",
  "tags": "example-value",
  "updatedAt": "example-value"
}